{
  "v": 1,
  "challenge_id": "00000000-0000-4000-8000-000000000004",
  "signing_payload": "ZmxlZXQtdjEKZmxlZXQtZml4dHVyZS1zZXJ2ZXIKZW5yb2xsCjAwMDAwMDAwLTAwMDAtNDAwMC04MDAwLTAwMDAwMDAwMDAwNApBQUVDQXdRRkJnY0lDUW9MREEwT0R4QVJFaE1VRlJZWEdCa2FHeHdkSGg4PQoxMXFZQVlLeENyZlZTLzdUeVdRSE9nN2hjdlBhcGlNbHJ3SWFhUGNIVVJvPQoKZWMxYmE1ZTQ4YzRmZDNkY2M5ZWVhYzZiZWRkNDM4NmEzMjE5OWYwNTA5ODk3YWJlZjhkOTkxOWUzMDQxYWQ4ZgoxNzM1Njg5NjYwMDAwCg==",
  "expires_at": 1735689660000
}
