{
  "v": 1,
  "challenge_id": "00000000-0000-4000-8000-000000000005",
  "signing_payload": "ZmxlZXQtdjEKZmxlZXQtZml4dHVyZS1zZXJ2ZXIKYXV0aAowMDAwMDAwMC0wMDAwLTQwMDAtODAwMC0wMDAwMDAwMDAwMDUKQUFFQ0F3UUZCZ2NJQ1FvTERBME9EeEFSRWhNVUZSWVhHQmthR3h3ZEhoOD0KMTFxWUFZS3hDcmZWUy83VHlXUUhPZzdoY3ZQYXBpTWxyd0lhYVBjSFVSbz0KMDAwMDAwMDAtMDAwMC00MDAwLTgwMDAtMDAwMDAwMDAwMDAyCgoxNzM1Njg5NjYwMDAwCg==",
  "expires_at": 1735689660000
}
